{
  "schema_version": 1,
  "slug": "delivery-chunk",
  "title": "Cohort chunk delivery",
  "description": "Delivery of one cohort chunk through implementation, joint read-only verification, and verdict-routed remediation. With --with-design, design review and design QA join verification; release preparation remains on the integrated cohort.",
  "start_stage": "implement",
  "limits": {
    "max_total_transitions": 12,
    "max_stage_attempts": 3,
    "max_consecutive_failures": 3
  },
  "stages": ["implement", "verify", "remediate"],
  "design_composition": {
    "stage_overrides": {
      "verify": {
        "evidence_workers": [
          {
            "persona": "design-reviewer",
            "role": "design-review",
            "scope": "Independently review the implemented UI against the authoritative design specification, HTML mocks, tokens, states, and design acceptance criteria. Record concrete findings for the verifier and do not review unrelated architecture."
          },
          {
            "persona": "design-qa",
            "role": "design-qa",
            "scope": "Verify the implemented UI behavior against the authoritative design specification, HTML mocks, and design acceptance criteria. Record reproducible design QA evidence for the verifier and route defects through the existing verdict."
          }
        ]
      }
    }
  }
}
